{
  "id": "quality-improvement-rca-action-plan",
  "title": "Quality-Improvement RCA & Action Plan",
  "category": "regulatory_quality_prompts",
  "author": "proompts team",
  "created": "2024-01-01",
  "last_modified": "2024-01-01",
  "tested_model": "gpt-4o",
  "temperature": 0.2,
  "tags": [
    "quality",
    "RCA"
  ],
  "prompt": {
    "purpose": "Identify root causes of a recurring defect and propose a 90\u2011day corrective\u2011action roadmap.",
    "context": "You are a Six\u2011Sigma Black Belt and supplier\u2011quality lead. Provided data includes a CSV of defect occurrences (date, line, batch, severity) and a list of mitigation steps already tried.",
    "instructions": "1. Determine the top three suspected root causes using 5\u00a0Whys reasoning (hide chain of thought).\n1. For each cause, list preventive and detective controls.\n1. Prioritize actions using an Effort\u2011Impact matrix (High/Medium/Low).\n1. Produce:\n   - A markdown table summarizing RCA causes and controls.\n   - A Gantt\u2011style action plan with ISO\u00a08601 start and end dates.\n1. End with a 50\u2011word elevator\u2011pitch summary for executives.",
    "inputs": "- `{{defect_data_csv}}` \u2014 defect details.\n- `{{prior_mitigation}}` \u2014 mitigation steps already attempted.",
    "output_format": "Table and timeline followed by the short summary.",
    "additional_notes": "Keep total length \u2264600 words and use plain language.\n\n<!-- markdownlint-enable MD029 MD036 -->",
    "example_usage": "",
    "references": ""
  }
}