{
  "id": "bd-rapid-proposal-builder",
  "title": "Rapid Proposal Builder",
  "category": "business_development_prompts",
  "author": "proompts team",
  "created": "2024-01-01",
  "last_modified": "2024-01-01",
  "tested_model": "gpt-4o",
  "temperature": 0.2,
  "tags": [
    "business development",
    "proposals"
  ],
  "prompt": {
    "purpose": "Draft a concise capabilities and budget proposal for a prospective client.",
    "context": "You are a senior proposal manager at a mid-size CRO. The client is developing a first-in-class bispecific antibody (IND planned Q4\u00a02026).",
    "instructions": "1. Produce an executive summary (\u2264120 words) in a persuasive tone.\n1. List CRO differentiators in bullet form (\u226420 words each).\n1. Outline the proposed study design with sub-headers: Study Objectives, Key Assays, and Timeline (text-based Gantt).\n1. Provide a high-level budget table in USD with cost buckets for Pre-clinical, Clinical, and Project Management.\n1. Suggest two optional accelerator offerings (e.g., biomarker assay panel, eSource setup).\n1. Conclude with a clear call to action.\n1. Keep the entire document \u22642\u00a0000 words and formatted in Markdown for easy copy-paste.",
    "inputs": "- `{{client_name}}`",
    "output_format": "Markdown document with headings and a budget table.",
    "additional_notes": "Emphasize our ability to deliver GLP toxicology and Phase\u00a0I services efficiently.",
    "example_usage": "",
    "references": ""
  }
}