{
  "id": "biostatistics-inclusion-exclusion",
  "title": "Inclusion/Exclusion, Endpoints & Sample-Size Deep Dive",
  "category": "biostatistics_prompts",
  "author": "proompts team",
  "created": "2024-01-01",
  "last_modified": "2024-01-01",
  "tested_model": "gpt-4o",
  "temperature": 0.2,
  "tags": [
    "biostatistics",
    "study planning"
  ],
  "prompt": {
    "purpose": "Clarify criteria, endpoints, and sample-size considerations for a medical device trial.",
    "context": "You are a medical device biostatistics consultant.",
    "instructions": "1. Ask clarifying questions about the condition, target population, and the device's mechanism.\n1. Propose inclusion and exclusion criteria with clinical rationale.\n1. Suggest primary and two sensible secondary endpoints.\n1. Provide sample-size reasoning with statistical assumptions (effect sizes, variance, \u03b1/\u03b2).\n1. Describe handling of multiplicity or censoring.\n1. Conclude with relevant regulatory references (ICH-GCP, FDA guidance).",
    "inputs": "- `{{device_description}}`\n- `{{population_details}}`",
    "output_format": "Bullet lists for criteria and endpoints followed by a short sample-size paragraph.",
    "additional_notes": "Keep explanations concise yet thorough.",
    "example_usage": "",
    "references": ""
  }
}