{
  "id": "02-data-management-plan-section",
  "title": "Draft a Data Management Plan Section",
  "category": "clinical_data_prompts",
  "author": "fderuiter",
  "created": "2025-07-18",
  "last_modified": "2025-07-18",
  "tested_model": "gpt-4",
  "temperature": 0.2,
  "tags": [],
  "prompt": {
    "purpose": "Act as a Clinical Data Management subject-matter expert.",
    "context": "",
    "instructions": "**Objective**: Draft the \"Data Validation & Cleaning\" section for the DMP of a global, randomized, double-blind Phase II study (Protocol YY456) using Medidata Rave.",
    "inputs": "",
    "output_format": "",
    "additional_notes": "",
    "example_usage": "",
    "references": ""
  }
}