{
  "id": "agents-md-checklist",
  "title": "AGENTS.md Checklist Generator",
  "category": "meta_prompts",
  "author": "proompts team",
  "created": "2024-01-01",
  "last_modified": "2024-01-01",
  "tested_model": "gpt-4o",
  "temperature": 0.2,
  "tags": [
    "meta",
    "documentation"
  ],
  "prompt": {
    "purpose": "Create a best-practice checklist for writing an AGENTS.md file and provide a meta\u2011prompt to generate one from any repository.",
    "context": "You are an expert software-documentation agent.",
    "instructions": "1. Summarize key elements every AGENTS.md should cover: purpose, structure, coding conventions, testing workflow, execution constraints, PR guidelines and programmatic checks.\n1. Provide a ready-to-use meta\u2011prompt that analyzes a repository at `{{repo_url}}` and outputs a compliant AGENTS.md.\n1. Keep bullets concise and commands in code blocks.\n1. Return only the markdown content with no commentary.",
    "inputs": "- `{{repo_url}}` \u2013 URL of the target repository",
    "output_format": "Markdown document containing the checklist and the meta\u2011prompt.",
    "additional_notes": "Mention that nested AGENTS.md files override parent rules and direct system prompts override all.",
    "example_usage": "",
    "references": ""
  }
}