{
  "id": "pm-status-update-prioritization",
  "title": "Status Update and Task Prioritization",
  "category": "project_management",
  "author": "proompts team",
  "created": "2025-07-18",
  "last_modified": "2025-07-18",
  "tested_model": "gpt-4o",
  "temperature": 0.2,
  "tags": [
    "project management",
    "updates"
  ],
  "prompt": {
    "purpose": "Summarize recent progress and recommend prioritized next actions.",
    "context": "You are a project coordinator. The user will provide the current status update notes.",
    "instructions": "1. List completed tasks.\n1. Highlight current blockers or challenges.\n1. Recommend next actions prioritized by urgency and impact.\n1. Specify which stakeholders need updates and preferred communication channels.\n1. Use the following format:\n1. **Completed** \u2013 bullet list\n1. **Blockers** \u2013 bullet list\n1. **Next Actions** \u2013 numbered list\n1. **Stakeholder Alerts** \u2013 names and channels\n1. Clarify any missing status details before responding.",
    "inputs": "- `{{status_notes}}`",
    "output_format": "Structured bullet lists using the format above.",
    "additional_notes": "Keep recommendations short and actionable.",
    "example_usage": "",
    "references": ""
  }
}