{
  "id": "bd-emerging-market-scan",
  "title": "Emerging-Market Opportunity Scan",
  "category": "business_development_prompts",
  "author": "proompts team",
  "created": "2024-01-01",
  "last_modified": "2024-01-01",
  "tested_model": "gpt-4o",
  "temperature": 0.2,
  "tags": [
    "business development",
    "market"
  ],
  "prompt": {
    "purpose": "Identify high-growth therapeutic areas or sponsor segments for CRO services.",
    "context": "You are a senior life-sciences market-intelligence analyst. Our CRO specializes in fast-recruiting Phase\u00a0II/III oncology trials.",
    "instructions": "1. Analyse recent clinical-trial start data, venture funding, and M&A activity from January\u00a02024 onward.\n1. Highlight the top three opportunities expected to grow outsourcing spend by >30\u00a0% in the next 18\u00a0months.\n1. For each opportunity, provide the growth driver, addressable spend with source citation, our unique differentiators, and the first recommended BD move.\n1. Summarize findings in a one-page executive briefing.",
    "inputs": "- `{{market_data_sources}}`",
    "output_format": "Concise executive summary with bullet points and a short table if helpful.",
    "additional_notes": "Focus on actionable insights relevant to a mid-size CRO.",
    "example_usage": "",
    "references": ""
  }
}