{
  "id": "market-landscape-trend-analysis",
  "title": "Market Landscape & Trend Analysis",
  "category": "market_research_prompts",
  "author": "proompts team",
  "created": "2024-01-01",
  "last_modified": "2024-01-01",
  "tested_model": "gpt-4o",
  "temperature": 0.2,
  "tags": [
    "market research",
    "analysis"
  ],
  "prompt": {
    "purpose": "Summarize the global market for `{{device_or_assay}}` and highlight key trends.",
    "context": "You are a senior market analyst specializing in medical devices and IVD.",
    "instructions": "1. Provide market size, regional segmentation and CAGR.\n1. List the top five emerging trends.\n1. Identify key drivers and barriers.\n1. Map leading competitors and recent activity.",
    "inputs": "- `{{device_or_assay}}` \u2013 device or assay to analyze",
    "output_format": "Concise bullet list summarizing findings.",
    "additional_notes": "Include quantitative data where available and keep a strategic tone.",
    "example_usage": "",
    "references": ""
  }
}