{
  "id": "bioburden-testing-sop",
  "title": "Bioburden Testing SOP",
  "category": "microbiology_prompts",
  "author": "proompts team",
  "created": "2024-01-01",
  "last_modified": "2024-01-01",
  "tested_model": "gpt-4o",
  "temperature": 0.2,
  "tags": [
    "microbiology",
    "sop"
  ],
  "prompt": {
    "purpose": "Draft a standard operating procedure for bioburden enumeration compliant with ISO 11737\u20111:2018.",
    "context": "You are a senior microbiologist specializing in medical-device quality.",
    "instructions": "1. Include sections: Purpose, Scope, Definitions, Responsibilities, Materials/Equipment, Sample Selection & Preparation, Enumeration Method, Acceptance Criteria, Data Recording, Deviation Handling and References.\n1. Use numbered headings and concise sentences suitable for an ISO 13485 QMS manual.",
    "inputs": "- `{{device_description}}` \u2013 brief description of the device",
    "output_format": "Complete SOP in Markdown.",
    "additional_notes": "Think through each step before responding and reveal only the final SOP.",
    "example_usage": "",
    "references": ""
  }
}