{
  "id": "ld-scenario-based-microlearning",
  "title": "Scenario-Based Microlearning Series",
  "category": "learning_development_prompts",
  "author": "prompt-team",
  "created": "2025-07-18",
  "last_modified": "2025-07-18",
  "tested_model": "gpt-4o",
  "temperature": 0.2,
  "tags": [
    "training",
    "compliance"
  ],
  "prompt": {
    "purpose": "Design short interactive modules that help CRO staff apply GCP principles correctly during site visits.",
    "context": "Recent audits show increased protocol deviations linked to poor application of GCP guidelines. Scenario-based practice improves knowledge transfer.",
    "instructions": "1. List three high-risk violation themes to target and explain why.\n1. Outline one complete sample module with scenario synopsis, branching decision points, feedback logic, and regulatory citations.\n1. After approval, create briefs for the remaining five modules.\n1. Incorporate adult-learning techniques such as retrieval practice, spaced repetition, and immediate feedback.\n1. Design for mobile-first LMS (SCORM 1.2) and specify metrics like completion and confidence ratings.",
    "inputs": "- `{{audience_role}}` \u2013 primary learner roles (e.g., CRAs, Study Coordinators).",
    "output_format": "Markdown sections titled **Violation Themes**, **Sample Module**, **Module Briefs**, and **Metrics**.",
    "additional_notes": "Ask clarifying questions before step two if necessary.",
    "example_usage": "",
    "references": ""
  }
}