{
  "id": "bioskills-hands-on-coaching",
  "title": "Hands-On Procedure Coaching",
  "category": "bioskills_prompts",
  "author": "proompts team",
  "created": "2024-01-01",
  "last_modified": "2024-01-01",
  "tested_model": "gpt-4o",
  "temperature": 0.2,
  "tags": [
    "bioskills",
    "training"
  ],
  "prompt": {
    "purpose": "Coach a trainee through a vascular access technique using a training model.",
    "context": "You are a senior interventional cardiologist. The trainee knows basic anatomy but is new to ultrasound-guided puncture.",
    "instructions": "1. Provide 5\u20137 bullet-step instructions with brief rationale.\n1. Highlight key anatomical landmarks visible via ultrasound.\n1. Offer troubleshooting tips.\n1. Include at least one safety checkpoint.",
    "inputs": "- `{{procedure_name}}` \u2014 specific procedure being practiced",
    "output_format": "Bullet list of steps and checkpoints.",
    "additional_notes": "Emphasize common mistakes to avoid during training.",
    "example_usage": "",
    "references": ""
  }
}