{
  "id": "pm-rollout-risk-matrix",
  "title": "Rollout Risk Matrix",
  "category": "project_management",
  "author": "proompts team",
  "created": "2025-07-18",
  "last_modified": "2025-07-18",
  "tested_model": "gpt-4o",
  "temperature": 0.2,
  "tags": [
    "project management",
    "risk"
  ],
  "prompt": {
    "purpose": "Assess rollout risks and propose key mitigation actions.",
    "context": "You are planning the deployment of project\u00a0X and need a quick risk overview.",
    "instructions": "1. List up to 10 identified risks as bullet points.\n1. Convert them into a 3\u00d73 risk-matrix table where rows represent Likelihood (Low/Med/High) and columns represent Impact (Low/Med/High). Mark each cell with the applicable risk labels.\n1. After the matrix, propose the top two mitigation actions in 35 words or fewer each, citing which risks they address.\n1. Keep the total answer under 250 words and prioritize implementation.",
    "inputs": "- `{{risk_list}}`",
    "output_format": "Markdown table followed by short mitigation actions.",
    "additional_notes": "Keep explanations minimal and implementation-focused.",
    "example_usage": "",
    "references": ""
  }
}